{
  "blockers": [
    {
      "id": "INITIALIZATION",
      "reason": "Project has not run.",
      "release_condition": "Complete intake, planning, research, decisions, production requirements, and validation."
    }
  ],
  "checks": {
    "claim_references_resolved": false,
    "completion_report_terminal": true,
    "decisions_traceable": false,
    "evidence_ledger_valid": false,
    "mandatory_questions_terminal": false,
    "manifest_valid": false,
    "no_private_raw_in_git": true,
    "privacy_review_complete": false,
    "requirements_testable": false,
    "research_quality_sufficient": false,
    "rights_review_complete": false,
    "sources_independent_enough": false
  },
  "completed_at": "2026-08-21T09:04:24+09:00",
  "gaps": [],
  "project_id": "project/probe-unattended",
  "questions_without_independent_sources": [],
  "reopen_triggers": [],
  "status": "BLOCKED"
}
