{
  "blockers": [],
  "checks": {
    "claim_references_resolved": true,
    "completion_report_terminal": true,
    "decisions_traceable": true,
    "evidence_ledger_valid": true,
    "mandatory_questions_terminal": true,
    "manifest_valid": true,
    "no_private_raw_in_git": true,
    "privacy_review_complete": true,
    "requirements_testable": true,
    "research_quality_sufficient": true,
    "rights_review_complete": true,
    "sources_independent_enough": true
  },
  "completed_at": "2026-08-11T00:21:00+09:00",
  "gaps": [
    {
      "id": "GAP001",
      "impact": "Repeat the frame review before installation-scale production.",
      "reason": "The target venue lighting condition was not externally tested."
    }
  ],
  "project_id": "project/harmony-study",
  "questions_without_independent_sources": [],
  "reopen_triggers": [
    "venue_lighting_change",
    "new_counterevidence"
  ],
  "status": "COMPLETE_WITH_GAPS"
}
